timestamp,question,answer,fallback_reason
2025-08-02 15:53:59,How to treat leaf blight in potatoes?,"Source: LLM knowledge & Web Search

To treat leaf blight in potatoes, follow these steps for non-chemical control and focus on preventative measures, as chemical treatments are generally not available for gardeners.

### Understanding Potato Blight
Potato blight, also known as late blight, is a serious disease caused by the fungus-like organism *Phytophthora infestans*. It attacks the foliage and tubers of potatoes, leading to rapid decay, especially in warm, wet, or humid conditions. The spores spread easily by wind and can be washed into the soil to infect tubers [1, 2].

### Identifying Symptoms
Look for the following signs of potato blight:",FallbackAgriTool_called
2025-09-10 09:58:44,what are the improved varieties of maize?,Database search failed - using LLM fallback (Source: Fallback LLM),FallbackAgriTool_called
2025-09-10 09:59:48,what are the improved varieties of maize?,"## Improved Maize Varieties: A Deep Dive for 2024

Okay, let's talk improved maize varieties. It's a huge topic, as breeding is constantly evolving! ""Improved"" means a lot of things – higher yield, disease resistance, drought tolerance, better grain quality, etc. Here's a breakdown, categorized for clarity, covering what's currently making waves in 2024.  I'll cover types, key traits, and some examples (though availability varies *greatly* by region - I'll note that).

**First, understanding the main types of improved maize:**

* **Open-Pollinated Varieties (OPVs):** These are older, but still important, especially for smallholder farmers. They can be saved and replanted year after year, but yield is generally lower and less stable than hybrids.  Improvements focus on disease resistance and adaptation to local conditions.
* **Hybrid Maize:**  The dominant force in modern maize production. Created by crossing two inbred lines, resulting in *hybrid vigor* (higher yield, better growth).  Farmers *must* purchase new seed each year as saved seed won't breed true.  Most improvements are happening in this category.
* **GMO (Genetically Modified) Maize:**  These varieties have had their genetic material altered to introduce specific traits (e.g., insect resistance, herbicide tolerance).  Regulations and acceptance vary widely globally.
* **QPM (Quality Protein Maize):**  A special type bred to have higher levels of essential amino acids (lysine and tryptophan), improving nutritional value.  Can be OPV or hybrid.



**Now, let's look at key traits being improved and examples of varieties (categorized by focus):**

**1. Yield & Adaptability:**

* **Focus:**  Maximizing grain production per hectare, across different environments.
* **Improvements:**  Strong root systems, efficient nutrient uptake, improved photosynthetic efficiency, tolerance to varying plant populations.
* **Examples:**
    * **Pioneer P1576:** (Widely available in North & South America, Europe) - Known for high yield potential and good stress tolerance.
    * **Dekalb DK60-76:** (North America, parts of South America) -  Excellent yield and grain fill under challenging conditions.
    * **Syngenta NK603:** (Global, but regional variations) -  High yielding, adaptable to various soil types.
    * **Zamani (Africa):** A popular hybrid in Eastern and Southern Africa, known for good yield and drought tolerance.
    * **DMR-SR-Y55 (Africa):**  Developed by CIMMYT and partners, specifically for drought-prone areas.

**2. Drought Tolerance & Water Use Efficiency:**

* **Focus:**  Maintaining yield under limited water conditions.  Crucial for climate change adaptation.
* **Improvements:**  Deep root systems, efficient stomatal control, improved osmotic adjustment.
* **Examples:**
    * **DroughtGard® Hybrids (Monsanto/Bayer):** (North & South America, some parts of Africa) -  Genetically modified to express a cold-shock protein, enhancing drought tolerance. (GMO)
    * **WE3214 (Africa):** Developed by CIMMYT, specifically for dryland areas.
    * **Pioneer P1732:** (North America) -  Demonstrates good performance in water-limited environments.
    * **Many CIMMYT-bred lines:** CIMMYT (International Maize and Wheat Improvement Center) is a major player in developing drought-tolerant maize for developing countries.  Look for varieties released by national programs based on CIMMYT lines.

**3. Disease & Pest Resistance:**

* **Focus:** Reducing crop losses from common maize diseases (e.g., Maize Lethal Necrosis, Gray Leaf Spot, Fusarium ear rot) and pests (e.g., stem borers, fall armyworm).
* **Improvements:**  Genetic resistance genes, Bt toxin expression (in GMO varieties for insect resistance).
* **Examples:**
    * **Bt Maize (various brands):** (Global, with regulations) - Genetically modified to express *Bacillus thuringiensis* (Bt) toxin, providing resistance to certain insect pests. (GMO)
    * **Pioneer P1476:** (North America) -  Good resistance to Gray Leaf Spot and Northern Corn Leaf Blight.
    * **Dekalb DK61-76:** (North America) -  Strong resistance to common maize diseases.
    * **Local varieties bred for specific regional diseases:**  National agricultural research institutions often develop varieties with resistance to locally prevalent diseases.

**4. Nutritional Quality (QPM & Biofortification):**

* **Focus:** Increasing the levels of essential nutrients in maize grain.
",FallbackAgriTool_called
2025-09-10 10:43:56,What to keep in mind while growing onions?,Database search failed - using LLM fallback (Source: Fallback LLM),FallbackAgriTool_called
2025-09-10 10:44:32,What to keep in mind while growing onions?,"Okay, shifting gears from barley to onions! Growing onions successfully takes a bit of attention. Here are a few key things to keep in mind:

* **Sunlight:** Onions need *at least* 6-8 hours of direct sunlight per day. More is better!
* **Soil:** Well-drained soil is crucial. Onions don't like to sit in soggy ground. Loamy soil is ideal, but you can amend heavier clay soils with compost.
* **Watering:** Consistent moisture is important, especially during bulb formation. But avoid overwatering!
* **Fertilizer:** Onions are heavy feeders. Use a balanced fertilizer, and side-dress with nitrogen a few times during the growing season.
* **Weed Control:** Keep the area around your onions weed-free, as weeds compete for nutrients and sunlight.
* **Pests & Diseases:** Watch out for onion maggots, thrips, and fungal diseases like downy mildew. Regular inspection can help you catch problems early.

Is there anything *specific* about growing onions you're concerned about? Knowing what you're particularly interested in (like starting from seeds vs. sets, or a specific pest problem) will help me give you more tailored advice.



**(Just a quick note, since we were just talking about pesticides for barley - remember to always follow label instructions carefully when using *any* pest or disease control products on *any* crop, including onions!)**",FallbackAgriTool_called
