Year,Month,Day,Crop,DistrictName,Season,Sector,StateName,QueryText,KccAns
2016,8,7,Cotton Kapas,FATEHABAD,KHARIF,AGRICULTURE,HARYANA,Information regarding to total dosese of fertilizers in cotton crop ,urea  140kgssp-150 kgpotas-40 kgzinc-10 kgacre
2019,1,15,Other,PANIPAT,,AGRICULTURE,HARYANA,information regarding site for check subsidies,site agriharyanaorg
2021,1,5,Wheat,FARIDABAD,,AGRICULTURE,HARYANA,TELL ME NUTRIENT MANAGEMENT  ,NPK 18:18:18   10         
2013,10,20,Mustard,SIRSA,KHARIF,AGRICULTURE,HARYANA,Information regarding improved varieties of sarson,RH-30RH-0749RH-9801RH-9304T-59RB-50
2014,12,8,Wheat,FATEHABAD,RABI,AGRICULTURE,HARYANA,information regarding control of termite in wheat ,broadcasting of chloropyriphos20 2 litre  2 litre of water25 kg of soilacre
2010,11,27,Wheat,MAHENDRA GARH,KHARIF,AGRICULTURE,HARYANA,information regarding to the fertilizers dose in wheat crop ,to the fertilizers dose in wheat crop is dap-50kgurea-110kgmop-20kgzinc sulphate- 10kgacre
2017,9,12,Mustard,JIND,KHARIF,AGRICULTURE,HARYANA,informaton regarding of varieties of musturd,RH-30  T-59 RH-8113 RB-50 RH 8812 RH 781 RH-819  RH 9304 RH 9801 RH 0406 RB 9901 RH - 0749
2016,6,2,BhindiOkraLadysfinger,KARNAL,KHARIF,HORTICULTURE,HARYANA,SOWING TIME OF BHINDI ,SOWING TIME OF BHINDI FEBUARY - MARCH  JUNE JULY MONTH 
2017,11,26,Mustard,REWARI,,AGRICULTURE,HARYANA,INFORMATION REGARDING OF IRRIGATION TIME IN MUSTERD CROP ,FIRST IRRIGATION IN MUSTERD CROP AT FLOWRING STAGE
2022,9,3,Others,GURGAON,,AGRICULTURE,HARYANA,Haryana State Agricultural Marketing Board,Haryana State Agricultural Marketing BoardC-6 SECTOR - 6PANCHKULAHARYANA  INDIAChief Admin BoardEPABX:     91-172-2560056 2560256 2560143 2560229Website:     wwwhsamborgin Toll Free No 18001802060
2017,1,23,Barseem,AMBALA,RABI,AGRICULTURE,HARYANA,information regarding to fungal in barseem ,control of fungal in barseem - 500 gm bavistin in 200 liter of water per acre
2012,7,31,1137,FARIDABAD,JAYAD,AGRICULTURE,HARYANA,information regarding fertilizer dose in basmati ,urea 80 kg  SSP-75 KG   zinc-10 kg
2009,4,1,Cotton Kapas,GURGAON,JAYAD,AGRICULTURE,HARYANA,INFORMATION REGARDING TO IMPROVED THE VARITIES OF COTTON CROP ,I TOLD THE KISAN TO IMPROVED THE VARITIES OF COTTON CROP IS HHH-223HHH-287H-1117
2023,1,28,Others,KAITHAL,,AGRICULTURE,HARYANA,Information regarding subsidies,        http:agriharyanaorg  http:hortharyanagovinen   https:agriharyanagovin   https:saralharyanagovin    0172-2571553  1800 180 2117   
2018,12,23,Wheat,PANIPAT,0,AGRICULTURE,HARYANA,Information regarding control of mixed weed in wheat,Spray atlantis 160 gram or total16 gram or vesta 160gram 500 gram surfactant  or acord plus 500 mililiter  dissolve in 200 liter water per acre within 30-35 days  after sowing
2018,4,28,Others,JIND,,AGRICULTURE,HARYANA,Information regarding Weather ,There will be some clouds  no some chance of rainfall 
2024,11,4,Others,SIRSA,,AGRICULTURE,HARYANA,Information regarding subsidy on paddy straw management,          https:agriharyanagovinapplyschemes     30112024                         21  -134117   :- 0172 2571553 2521900      1800 180 2117      9     5      
2022,11,25,Onion,JHAJJAR,,HORTICULTURE,HARYANA,Information regarding sowing time of onion,      :-                                 35             -2   -3     -4         -53              4 - 5         3 -4                   :- 20    100   125      35      10    21     I        400-500    45    900 -1100      30  400-500      50-60              8-10               350   Oxyflurfen  23 5  EC     50 -60               8 -10                175    2 8  EC   60      25 EC  300    50  EC  140 -160                         400 -500   -45      200           -99  20     100                         19: 19: 19  100   10             2000                         1                  15        10    1          200     Hisar -2 -  130-145 Days 120 Qtl  Pusa Red :- 125-140 Days 100-120 Qtl    Hisar Onion -3:- 130-140 Days 125 Qtl    Hisar Onion -4 :- 130-135 Days 132 Qtl     Khrif onion varieties : Nipad -53 N-53 :- 140-145 Days 90-100 qtl  Agrifound Dark Red  ADR  :- 140-150 Days 110-120 Qtl    :                                 : 9    430           01662-255433  34        1800 180 3001                                  4--        01662- 284321 255405       01662-284323 255430 255432          01662-255433 255434                 18001803001    1000  1200       18001803111  1000  1200        18001804002   
2016,7,13,Green Gram Moong Bean Moong,BHIWANI,KHARIF,AGRICULTURE,HARYANA,yellow mosaic virus in greengram,Spray methyl demeton 25 EC 200 mlacre for control of yellow mosaic virus in greengram
2022,6,10,Green Gram Moong Bean Moong,BHIWANI,,AGRICULTURE,HARYANA, Information regarding  varieties of moong  ,    -    MH-421 1142
2016,5,30,Cotton Kapas,BHIWANI,KHARIF,AGRICULTURE,HARYANA,improved varieties of BT cotton ,Rasi-134 Rasi-138 Rasi-650 Rasi-653 R C H- 776R C H -602 ankur -3028 sriram-64886588 bayare-7007
2010,2,3,Others,KARNAL,KHARIF,AGRICULTURE,HARYANA,FARMER ASKS ME ABOUT THE TOLL FREE NUMBER OF HISAR UNIVERSITY ,18001803001USE ANY NETWORK
2011,8,10,Cotton Kapas,FATEHABAD,JAYAD,AGRICULTURE,HARYANA,how to control thirips in cotton crop ,spray to carvoril  600 gm in 200 liter of water  acre 
2017,8,4,Cotton Kapas,SIRSA,KHARIF,AGRICULTURE,HARYANA,Information regarding how to control white  fly in cotton crop ,spray 200ml oberon 50 gm ektara 500 ml nimbisidin mixed in 200liter water  ecd 
2010,2,24,1275,BHIWANI,,HORTICULTURE,HARYANA,SOWING TIME OF BOTTLE GOURD ,FEB-MARCH 
2014,9,9,Cotton Kapas,SONEPAT,KHARIF,AGRICULTURE,HARYANA,how control disease in cotton ,how control disease in cotton spray of coc  600-800 gram in 150-200 litre water per acre
2019,2,3,Wheat,REWARI,,AGRICULTURE,HARYANA,Information regarding how to control mixed weeds in wheat crop ,Spray 500 ml accord plus in  250 liter water  acre at 30-35 days after sowing time 
2020,12,30,Others,JIND,,AGRICULTURE,HARYANA,information regarding  Pradhan Mantri Fasal bima yojana ,--                    common service centre   1800-103-0061    
2016,9,11,Cotton Kapas,HISSAR,KHARIF,AGRICULTURE,HARYANA,How to control flower dropping in cotton ,How to control flower dropping in cotton  spray of N:P:K 13:00:45 2 kg in 200 liter water 
2010,7,2,Guar,HISSAR,JAYAD,AGRICULTURE,HARYANA,IMPROVED VARITIES OF GUARA CROP ,IMPROVED VARITIES OF GUARA CROP :- HG-75 HG-365 HG-563
2021,10,22,Mustard,BHIWANI,,AGRICULTURE,HARYANA,Information regarding  varieties  of mustard ,   RH-30  T-59 RH-8113 RB-50 RH 8812 RH 781 RH-819  RH 9304 RH 9801 RH 0406 RB 9901  RH - 0749RH-725RH- 725 -136-143DAYS FOR MATURITY25-26 MAN OR10-105 QUINTAL PER ACRE
2023,7,6,Radish,SONEPAT,,HORTICULTURE,HARYANA,Information regarding how to control insect pest  in radish,        250        25  EC    30  EC  250         
2021,9,17,Bitter Gourd,PALWAL,,HORTICULTURE,HARYANA,SOWING TIME OF BITTER GOURD ,                        i
2013,2,13,Bottle Gourd ,JIND,,HORTICULTURE,HARYANA,sowing time of bitter guard ,feb to march
2014,11,30,Potato,REWARI,RABI,HORTICULTURE,HARYANA,How to control Early Blight in potato,Spray 400 gm M-45 in 200 lt of water per acre
2017,10,17,Mustard,MAHENDRA GARH,RABI,AGRICULTURE,HARYANA,information regarding of varieties of mustard,RH-30  T-59 RH-8113 RB-50 RH 8812 RH 781 RH-819  RH 9304  RH 9801 RH 0406 RB 9901  RH - 0749
2018,6,25,Pearl Millet BajraBulrush MilletSpiked Millet,MAHENDRA GARH,KHARIF,AGRICULTURE,HARYANA,Information regarding improved varieties of Bajra,Information regarding improved varieties of BajraHHB-50 HHB-60 HHB-67 HHB-94 HHB-117 HHB-146 HHB-197 HHB-216 HHB-223
2015,5,27,Others,SIRSA,KHARIF,AGRICULTURE,HARYANA,INFORMATION REGARDING OF USSD SERVICE SEVA ,INFORMATION REGARDING OF USSD SERVICE SEVA -491103 OK
2015,9,15,Paddy Dhan,SONEPAT,KHARIF,AGRICULTURE,HARYANA,Information regarding how to control black grain in paddy crop ,spray propiconazole 25 ec  200 ml in 200 litre of wateracre
2014,2,4,Onion,JIND,KHARIF,HORTICULTURE,HARYANA,Information regarding to improved growth in onion crop ,spray npk 19:19:19  1 kg in 100 litre of wateracre
2020,6,5,fodder sorghum,GURGAON,,AGRICULTURE,HARYANA,INFORMATION REGARDING HOW TO IMPROVE GROWTH IN  SORGHUM CROP ,       NPK 19:19:19 1   100           
2024,1,3,Mustard,HISSAR,,AGRICULTURE,HARYANA,Information regarding improved growth in mustard ,         NPK 18:18:18 1   100        
2010,12,27,1296,ROHTAK,KHARIF,HORTICULTURE,HARYANA,CONTROL OF LATE BLIGHT IN POTATO CROP ,SPRAY TO INDOFIL-M-45  600 GM IN 200 LITRES OF WATERACRE 
2020,1,1,Wheat,HISSAR,,AGRICULTURE,HARYANA,Information regarding how to control mixed weeds in wheat crop ,             500     Fenoxaprop-p-ethyl 8 Metribuzin 14  160   Clodinafop propargyl  15  Metsulfuron methyl 1  WP   200       30 -35          
2022,4,20,Maize Makka,KAITHAL,,AGRICULTURE,HARYANA,Information regarding control of caterpillar in maize ,            500      36 SL 250    250         
2014,12,8,Pea Vegetable,BHIWANI,RABI,HORTICULTURE,HARYANA,information regarding  how to control thirps in pea crop ,information regarding  how to control thirps in pea crop spray 400 gm melathion or350 ml  rogor in 200 liter water   acre 
2017,9,25,Paddy Dhan,REWARI,KHARIF,AGRICULTURE,HARYANA,sowing time of oat ,sowing time of oat --15 october to 15 november 
2017,9,3,Cotton Kapas,ROHTAK,,AGRICULTURE,HARYANA,information regardingh how to control fangle disease in cotton ,control are:-spray-stereptocyclien6-8 gramcoc coper oxi cloried600-800 gram in 150-200 leetr water per acer
2017,2,27,Wheat,MAHENDRA GARH,RABI,AGRICULTURE,HARYANA,Information regarding HAU Helpline No,HAU Helpline no 1800-180-3001contect :-Monday Wednesdayand Friday 10 am to 12 am
2022,2,19,Others,GURGAON,,AGRICULTURE,HARYANA,other state call,               I
2018,4,13,Paddy Dhan,MAHENDRA GARH,KHARIF,AGRICULTURE,HARYANA,Information regarding sowing time of nursury of paddy ,sowing time of nursury of paddy  15 may to 30 june
2024,1,10,Others,PALWAL,,AGRICULTURE,HARYANA,Information regarding subsidies on Solar pump,   75         wwwsaralharyanagovin             - 0172 258 7233
2011,1,9,Wheat,JHAJJAR,KHARIF,AGRICULTURE,HARYANA,WEEDS CONTROL IN WHEAT CROP ,SPRAY OF ALGRIP  80 GM IN 200 LITRES OF WATER  ACRE 
2017,3,5,Wheat,MAHENDRA GARH,RABI,AGRICULTURE,HARYANA,Information regarding control of zinc deficiency in wheat ,spray 25kg Urea  500 gm Zinc in 100 Ltr of water acre 
2018,5,23,Others,REWARI,KHARIF,AGRICULTURE,HARYANA,Information regarding Weather ,some cloud and no chance of rainfall today 
2015,8,25,Others,SIRSA,KHARIF,AGRICULTURE,HARYANA,Weather of sirsa ,Today some chance of rain fall 
2025,3,5,Others,SONEPAT,,AGRICULTURE,HARYANA,Asked about to pm kisan samman nidhi yojana ,                  DBT    
2012,10,30,Wheat,KAITHAL,KHARIF,AGRICULTURE,HARYANA,Improved varieties of wheat,improved varieties of wheat: Raj 3765 WH 542WH 711 WH 1105 DBW 17 WH 157 PBW 343
2020,1,24,Others,BHIWANI,,AGRICULTURE,HARYANA,Farmer asked query on Weather,I                        20      6     21     
2012,4,12,Saffron,HISSAR,JAYAD,HORTICULTURE,HARYANA,sowing time of hisar  ,june -july 
2018,5,30,Wheat,YAMUNA NAGAR,KHARIF,AGRICULTURE,HARYANA,information regardingh weed control of paddy nursury ,weeds control in paddy paddy nursury:-broadcast in 600 gm sofitin 60 kg sand  acre
2020,8,12,Others,FATEHABAD,,AGRICULTURE,HARYANA,Information regarding subsidies for agriculture implement ,         www agriharyanacrm com               0172 -2571553   2571544            1      2000        1   -3      5000       3        10 000    https:khetibizcomagriculture-farm-implements-subsidy-anudan-india-2020-hindi     1      2000        1   -3      5000       3        10 000    
2018,8,3,Lethyrus,BHIWANI,,AGRICULTURE,HARYANA,TELL ME WEATHER INFORMATION,NO RAIN POSSIBILITY IN NEXT 5 DAYS
2015,1,27,Wheat,BHIWANI,RABI,AGRICULTURE,HARYANA,Information regarding for weed control in wheat crop,Spray acord plus 500 ml 200 liter of water per acer 32 days after sowing
2014,12,3,Barseem,SONEPAT,RABI,AGRICULTURE,HARYANA,How to control of slow groth and yellow leaf in barseem crops,How to  of slow groth and yellow leaf in barseem crops control are:- spray- megnisium sulphat 1kg in 100 liter water per acer
2020,10,16,Garlic,SIRSA,,HORTICULTURE,HARYANA, INFORMATION REGARDING SOWING TIME OF GARLIC ,25                  I
2022,6,4,Others,JHAJJAR,,AGRICULTURE,HARYANA,Information regarding PM Kisan Samman Nidhi Yojna,                   wwwpmkisangovin           011-24300606
2015,7,29,Cotton Kapas,FATEHABAD,KHARIF,AGRICULTURE,HARYANA,how to control leaf carl in cotton crops,spray500 ml trijophos 500ml nimbisidin in 200 lit in water  acre 151
2015,2,11,Guava,SIRSA,RABI,HORTICULTURE,HARYANA,How to control flower and fruit dropping ,Spray 1 ml Planofix or oriyofinzin per 45 lt of water
2009,8,4,9999,FATEHABAD,JAYAD,9999,HARYANA,CONTROL OF IRON DEFY IN PADDY ,SPRAY FERROUS SULPAHTE  500 GM IN 100 LIT WATER PER ACRE 
2022,9,28,Cotton Kapas,MEWAT,,AGRICULTURE,HARYANA,Information regarding control of flower and fruit dropping in cotton ,   -        2  N:P:K 13:00:45  200          
2018,7,18,Paddy Dhan,KARNAL,KHARIF,AGRICULTURE,HARYANA,how to control weeds of paddy crops ,spray 100 ml nominee gold  150 liter water per acre 
2015,5,13,Others,JHAJJAR,KHARIF,AGRICULTURE,HARYANA,Information regarding pusa farm helpline toll free no,Information regarding pusa farm helpline toll free noPusa farm helpline toll free no-1800118989
2018,10,2,Cauliflower,YAMUNA NAGAR,0,HORTICULTURE,HARYANA,how to control sundi in cauliflower  ,75 ml fanvalrate 20 EC or 60 ml cypermethrin 25 EC or 200 ml deltamethrin 28 EC in 200-250 liter water  acre 
2015,11,17,Others,FATEHABAD,RABI,AGRICULTURE,HARYANA,Information regarding varieties of wheat ,Improved varieties of Wheat-wh-1105whd-948wh-711pbw-343hd-2967dbw-17dbw -621 650 hd 2851 2894 
2023,6,27,Others,SIRSA,,AGRICULTURE,HARYANA,Information regarding subsidies,        http:agriharyanaorg  http:hortharyanagovinen   https:agriharyanagovin   https:saralharyanagovin    0172-2571553  1800 180 2117   
2014,8,9,Cotton Kapas,SIRSA,JAYAD,AGRICULTURE,HARYANA,information regarding how to control thirps in cotton crop ,information regarding how to control thirps in cotton crop spray of rogor 350 ml  1 liter nimbicidin in 200 liter water acre 
2016,9,6,Paddy Dhan,MAHENDRA GARH,KHARIF,AGRICULTURE,HARYANA,How to control flower dropping in cotton ,How to control flower dropping in cotton How to control flower dropping in cotton  spray of N:P:K 13:00:45 2 kg in 200 liter water 
2017,6,26,Others,KURKSHETRA,,AGRICULTURE,HARYANA,Information regarding of fishfarming ,Information regarding of fishfarming : contect no-0184-2269220124-2220679        :-0184-226922  0124-2220679 
2024,11,2,Wheat,BHIWANI,,AGRICULTURE,HARYANA,Information regarding fertilizer dose in wheat,      :- 60     46 130  24       16 150   DAP 50  12      60 20   21 10        100     50       20      10     21                 12:32:16  70-75           
2022,8,29,Sugarcane Noble Cane,PANIPAT,,AGRICULTURE,HARYANA,Information regarding control of Pest in sugarcane ,      150 ml   200 SL     200-250      
2017,5,19,Cotton Kapas,REWARI,,AGRICULTURE,HARYANA,improved varieties of BT cotton ,Rasi-134 Rasi-138 Rasi-650 Rasi-653 R C H- 776R C H -602 ankur -3028 sriram-64886588 bayare-7007
2017,11,7,Napier Grass,JHAJJAR,RABI,AGRICULTURE,HARYANA,varieties of rabi maize,HHM-1  HHM-2  HM-4  HM-5  HM-10  HM-11  HQPM-1  HQPM-5
2013,11,24,Tomato,JHAJJAR,KHARIF,HORTICULTURE,HARYANA,Information regarding seed treatment in tomato,Seed treatment for 25 gm Emisan or Captan or Thiram per kilogram of seed
2014,7,5,Cotton Kapas,JIND,JAYAD,AGRICULTURE,HARYANA,Information regarding control of zinc deficiency in cotton,control of zinc deficiency in cottonspray 25kg Urea  500 gm Zinc in 100 Ltr of water acre 
2015,10,14,Paddy Dhan,PALWAL,KHARIF,AGRICULTURE,HARYANA,HOW TO CONTROL FUNJAL DISEASE IN PADDY ,HOW TO CONTROL FUNJAL DISEASE IN PADDY  SPRAY OF CARVENDAJIM BABASTIN500 GM IN 200 LITER WATERACRE 
2014,4,23,Cotton Kapas,PALWAL,JAYAD,AGRICULTURE,HARYANA,Information regarding early varieties of BT cotton,Information regarding early varieties of BT cottonearly varieties of BT cotton-HHH-287HHH-223RCH-650BGIIRCH-776BGIIHHH-283
2018,11,3,Others,KAITHAL,0,AGRICULTURE,HARYANA,Information regarding Mandi rates of different crops,For Information regarding  Mandi rates of different crops- Contact  :- 1800 180 2060
2012,8,20,Guar,KARNAL,JAYAD,AGRICULTURE,HARYANA,how to control thirips in guara crop ,spray to malathion  200 ml in 200 liter of water  acre 
2015,4,24,Green Gram Moong Bean Moong,PALWAL,JAYAD,AGRICULTURE,HARYANA,improved varieties of moong ,Muskan Basanti satya SML-668  h m-421
2018,5,9,Cotton Kapas,MEWAT,KHARIF,AGRICULTURE,HARYANA,Information regarding improved varieties of btcotton crop ,Bt-cotton varieties  rashi-134138602650653779776sri ram-64886588ankur-3028 bg-2
2014,9,18,Carrot,BHIWANI,KHARIF,HORTICULTURE,HARYANA,information regarding varieties  in carrot,information regarding varieties  in carrot-hisar garic natis  pusa kesar 
2015,12,31,Wheat,JHAJJAR,RABI,AGRICULTURE,HARYANA,Information regarding  late varieties of wheat crop ,Late varities of wheat - HD-2851 HD-2932 RAJ-3765 PBW-373 UP-2338 W H-3061025
2015,5,21,Paddy Dhan,KAITHAL,KHARIF,AGRICULTURE,HARYANA,Information regarding seed treatment for nursary sowing in paddy,10 gm Emisan or 10 gm Carbendazim dissolve in 10 lt of water
2022,12,14,Others,KARNAL,,AGRICULTURE,HARYANA,information regarding Pradhanmantri Kisan Samman Nidhi Yojana contact number,                        wwwpmkisangovin       011-24300606        15526118001155266         
2016,6,8,Guar,SIRSA,KHARIF,AGRICULTURE,HARYANA,Information regarding improved varieties of Gwar,HG-75 HG-365 HG-563 HG-870 HG 2-20
2021,10,4,Mustard,SIRSA,,AGRICULTURE,HARYANA,Information regarding control of stem rot in mustard,            2  50 WP                         45-50   65-70       100  100          
2015,11,26,Wheat,JIND,RABI,AGRICULTURE,HARYANA,Information regarding first irrigation in wheat crop ,first irrigation in wheat crop sowing time after 21 to 25 days
2020,9,10,Cotton Kapas,BHIWANI,,AGRICULTURE,HARYANA,Information regarding control of whitefly JassidThrips  in cotton ,          300     30  EC    1        250         
2020,8,31,Cotton Kapas,FATEHABAD,,AGRICULTURE,HARYANA,information regarding Pradhan Mantri Fasal bima yojana  ,               1800-103-0061  1800 180 2117 Landline Nos: 91 11 46869800     
